{
  "schemaVersion": 1,
  "requestId": "problem-08-v4",
  "path": "outputs/problem-08.sgf",
  "queryNumber": 31,
  "queriesRemaining": 19,
  "checkedAt": "2026-08-08T00:18:02.955Z",
  "status": "invalid",
  "candidateSha256": "45abd8ff7dfd02e62c24bb3c49cb1024e8be73ac5935f5027197a913fb92dc0f",
  "cachedRemote": false,
  "local": null,
  "goProblems": null,
  "errors": [
    {
      "code": "suicide-move",
      "message": "W[rm] is suicide under ordinary Go rules."
    },
    {
      "code": "suicide-move",
      "message": "W[rm] is suicide under ordinary Go rules."
    }
  ]
}
