{
  "schemaVersion": 1,
  "requestId": "p04-a",
  "path": "outputs/problem-04.sgf",
  "queryNumber": 11,
  "queriesRemaining": 39,
  "checkedAt": "2026-08-07T20:11:57.462Z",
  "status": "duplicate",
  "candidateSha256": "ba7f942caa388077e1dbf3521838d1c966c6c5c769402a1c0820591410d9b187",
  "cachedRemote": false,
  "local": {
    "builtInSetupMatch": null,
    "exactReferenceMatch": null,
    "closestReferenceMatch": {
      "id": 18843,
      "percentage": 54.55,
      "url": "https://www.goproblems.com/problems/18843"
    },
    "peerExactMatches": [],
    "peerShapeMatches": []
  },
  "goProblems": {
    "radius": 2,
    "signatureMatches": [
      {
        "id": 30083,
        "difficulty": "25 kyu",
        "createdAt": "2024-05-27",
        "url": "https://www.goproblems.com/problems/30083"
      }
    ],
    "topPercentage": 97,
    "percentageMatches": [
      {
        "id": 30083,
        "difficulty": "25 kyu",
        "createdAt": "2024-05-27",
        "url": "https://www.goproblems.com/problems/30083",
        "percentage": 97
      },
      {
        "id": 9418,
        "difficulty": "10 kyu",
        "createdAt": "2006-11-10",
        "url": "https://www.goproblems.com/problems/9418",
        "percentage": 86
      },
      {
        "id": 18555,
        "difficulty": "20 kyu",
        "createdAt": "2014-12-08",
        "url": "https://www.goproblems.com/problems/18555",
        "percentage": 83
      },
      {
        "id": 18174,
        "difficulty": "24 kyu",
        "createdAt": "2014-11-15",
        "url": "https://www.goproblems.com/problems/18174",
        "percentage": 82
      },
      {
        "id": 19276,
        "difficulty": "18 kyu",
        "createdAt": "2015-04-06",
        "url": "https://www.goproblems.com/problems/19276",
        "percentage": 79
      },
      {
        "id": 34972,
        "difficulty": "11 kyu",
        "createdAt": "2024-08-14",
        "url": "https://www.goproblems.com/problems/34972",
        "percentage": 78
      },
      {
        "id": 43985,
        "difficulty": "28 kyu?",
        "createdAt": "2025-03-12",
        "url": "https://www.goproblems.com/problems/43985",
        "percentage": 78
      },
      {
        "id": 29210,
        "difficulty": "27 kyu",
        "createdAt": "2024-05-17",
        "url": "https://www.goproblems.com/problems/29210",
        "percentage": 76
      },
      {
        "id": 49033,
        "difficulty": "6 kyu?",
        "createdAt": "2025-08-04",
        "url": "https://www.goproblems.com/problems/49033",
        "percentage": 74
      },
      {
        "id": 18519,
        "difficulty": "5 kyu",
        "createdAt": "2014-12-07",
        "url": "https://www.goproblems.com/problems/18519",
        "percentage": 73
      },
      {
        "id": 28538,
        "difficulty": "3 kyu",
        "createdAt": "2024-05-09",
        "url": "https://www.goproblems.com/problems/28538",
        "percentage": 73
      },
      {
        "id": 56124,
        "difficulty": "25 kyu?",
        "createdAt": "2026-02-28",
        "url": "https://www.goproblems.com/problems/56124",
        "percentage": 73
      },
      {
        "id": 24299,
        "difficulty": "20 kyu?",
        "createdAt": "2023-11-16",
        "url": "https://www.goproblems.com/problems/24299",
        "percentage": 71
      },
      {
        "id": 31606,
        "difficulty": "10 kyu",
        "createdAt": "2024-07-06",
        "url": "https://www.goproblems.com/problems/31606",
        "percentage": 71
      },
      {
        "id": 32728,
        "difficulty": "20 kyu",
        "createdAt": "2024-07-16",
        "url": "https://www.goproblems.com/problems/32728",
        "percentage": 69
      },
      {
        "id": 46194,
        "difficulty": "30 kyu",
        "createdAt": "2025-05-04",
        "url": "https://www.goproblems.com/problems/46194",
        "percentage": 69
      },
      {
        "id": 32403,
        "difficulty": "2 dan",
        "createdAt": "2024-07-13",
        "url": "https://www.goproblems.com/problems/32403",
        "percentage": 67
      },
      {
        "id": 35102,
        "difficulty": "21 kyu",
        "createdAt": "2024-08-17",
        "url": "https://www.goproblems.com/problems/35102",
        "percentage": 67
      },
      {
        "id": 44990,
        "difficulty": "11 kyu?",
        "createdAt": "2025-04-02",
        "url": "https://www.goproblems.com/problems/44990",
        "percentage": 67
      },
      {
        "id": 52266,
        "difficulty": "5 kyu?",
        "createdAt": "2025-11-05",
        "url": "https://www.goproblems.com/problems/52266",
        "percentage": 64
      }
    ]
  },
  "errors": []
}
