{
  "schemaVersion": 1,
  "requestId": "problem-04-redesign-1",
  "path": "outputs/problem-04.sgf",
  "queryNumber": 11,
  "queriesRemaining": 39,
  "checkedAt": "2026-08-07T19:27:47.971Z",
  "status": "review",
  "candidateSha256": "878fe6ec447193f0b83d167d4324a9d91366cc519148b63a75fcdadc4b8d8074",
  "cachedRemote": false,
  "local": {
    "builtInSetupMatch": null,
    "exactReferenceMatch": null,
    "closestReferenceMatch": {
      "id": 19150,
      "percentage": 22.86,
      "url": "https://www.goproblems.com/problems/19150"
    },
    "peerExactMatches": [],
    "peerShapeMatches": []
  },
  "goProblems": {
    "radius": 2,
    "signatureMatches": [],
    "topPercentage": 88,
    "percentageMatches": [
      {
        "id": 51846,
        "difficulty": "30 kyu?",
        "createdAt": "2025-10-22",
        "url": "https://www.goproblems.com/problems/51846",
        "percentage": 88
      },
      {
        "id": 45398,
        "difficulty": "29 kyu",
        "createdAt": "2025-04-12",
        "url": "https://www.goproblems.com/problems/45398",
        "percentage": 59
      }
    ]
  },
  "errors": []
}
