{
  "schemaVersion": 1,
  "requestId": "p05-h",
  "path": "outputs/problem-05.sgf",
  "queryNumber": 35,
  "queriesRemaining": 15,
  "checkedAt": "2026-08-07T17:45:51.846Z",
  "status": "duplicate",
  "candidateSha256": "446a5c24261fcacbcd17b0ef1cd11cd4ee96108942248f007041281625557f9f",
  "cachedRemote": false,
  "local": {
    "builtInSetupMatch": null,
    "exactReferenceMatch": null,
    "closestReferenceMatch": {
      "id": 10507,
      "percentage": 28.57,
      "url": "https://www.goproblems.com/problems/10507"
    },
    "peerExactMatches": [],
    "peerShapeMatches": []
  },
  "goProblems": {
    "radius": 2,
    "signatureMatches": [],
    "topPercentage": 90,
    "percentageMatches": [
      {
        "id": 49893,
        "difficulty": "30 kyu",
        "createdAt": "2025-08-23",
        "url": "https://www.goproblems.com/problems/49893",
        "percentage": 90
      },
      {
        "id": 55927,
        "difficulty": "?",
        "createdAt": "2026-02-24",
        "url": "https://www.goproblems.com/problems/55927",
        "percentage": 80
      },
      {
        "id": 57733,
        "difficulty": "28 kyu?",
        "createdAt": "2026-04-12",
        "url": "https://www.goproblems.com/problems/57733",
        "percentage": 78
      },
      {
        "id": 46163,
        "difficulty": "29 kyu",
        "createdAt": "2025-05-03",
        "url": "https://www.goproblems.com/problems/46163",
        "percentage": 76
      },
      {
        "id": 26200,
        "difficulty": "10 kyu?",
        "createdAt": "2024-02-11",
        "url": "https://www.goproblems.com/problems/26200",
        "percentage": 65
      },
      {
        "id": 50301,
        "difficulty": "29 kyu?",
        "createdAt": "2025-09-01",
        "url": "https://www.goproblems.com/problems/50301",
        "percentage": 60
      },
      {
        "id": 52359,
        "difficulty": "14 kyu?",
        "createdAt": "2025-11-08",
        "url": "https://www.goproblems.com/problems/52359",
        "percentage": 60
      },
      {
        "id": 44401,
        "difficulty": "29 kyu?",
        "createdAt": "2025-03-24",
        "url": "https://www.goproblems.com/problems/44401",
        "percentage": 59
      },
      {
        "id": 58875,
        "difficulty": "7 kyu?",
        "createdAt": "2026-05-16",
        "url": "https://www.goproblems.com/problems/58875",
        "percentage": 56
      },
      {
        "id": 60387,
        "difficulty": "1 dan?",
        "createdAt": "2026-06-24",
        "url": "https://www.goproblems.com/problems/60387",
        "percentage": 56
      },
      {
        "id": 57795,
        "difficulty": "15 kyu?",
        "createdAt": "2026-04-13",
        "url": "https://www.goproblems.com/problems/57795",
        "percentage": 54
      },
      {
        "id": 3918,
        "difficulty": "8 dan",
        "createdAt": "2004-02-13",
        "url": "https://www.goproblems.com/problems/3918",
        "percentage": 49
      },
      {
        "id": 57846,
        "difficulty": "18 kyu?",
        "createdAt": "2026-04-14",
        "url": "https://www.goproblems.com/problems/57846",
        "percentage": 49
      },
      {
        "id": 55551,
        "difficulty": "12 kyu?",
        "createdAt": "2026-02-06",
        "url": "https://www.goproblems.com/problems/55551",
        "percentage": 48
      },
      {
        "id": 59761,
        "difficulty": "8 kyu?",
        "createdAt": "2026-06-08",
        "url": "https://www.goproblems.com/problems/59761",
        "percentage": 48
      },
      {
        "id": 57675,
        "difficulty": "8 kyu?",
        "createdAt": "2026-04-10",
        "url": "https://www.goproblems.com/problems/57675",
        "percentage": 47
      },
      {
        "id": 57240,
        "difficulty": "5 kyu?",
        "createdAt": "2026-03-30",
        "url": "https://www.goproblems.com/problems/57240",
        "percentage": 46
      },
      {
        "id": 57631,
        "difficulty": "8 kyu?",
        "createdAt": "2026-04-09",
        "url": "https://www.goproblems.com/problems/57631",
        "percentage": 45
      },
      {
        "id": 59425,
        "difficulty": "12 kyu?",
        "createdAt": "2026-05-31",
        "url": "https://www.goproblems.com/problems/59425",
        "percentage": 44
      },
      {
        "id": 18057,
        "difficulty": "15 kyu",
        "createdAt": "2014-11-10",
        "url": "https://www.goproblems.com/problems/18057",
        "percentage": 43
      }
    ]
  },
  "errors": []
}
